[
  {
    "Script Name": "about to mux shit up",
    "Script Version": "1.0.1",
    "Flame Version": "2022",
    "Maximum Flame Version": "Latest",
    "Author": "Kieran Hanrahan",
    "Creation Date": "02.22.24",
    "Update Date": "02.28.24",
    "Description": "Script Name: About to Mux Shit Up\nScript Version: 1.0.1\nFlame Version: 2022\nWritten By: Kieran Hanrahan\nCreation Date: 02.22.24\nUpdate Date: 02.28.24\n\nDescription:\n\nAttach Mux nodes to the output sockets of the selected Clip nodes in Batch.\n\nURL: http://github.com/khanrahan/about-to-mux-shit-up\n\nMenus:\n\nRight-click selected Clip nodes in the Batch schematic -> Create... -> About to Mux Shit Up\n\nTo install:\n\nFor all users, copy this file to:\n/opt/Autodesk/shared/python\n\nFor a specific user, copy this file to:\n/opt/Autodesk/user/<user name>/python"
  },
  {
    "Script Name": "add audio",
    "Script Version": "1.4.0",
    "Flame Version": "2023",
    "Maximum Flame Version": "Latest",
    "Author": "Michael Vaglienty",
    "Creation Date": "02.04.22",
    "Update Date": "01.20.24",
    "Description": "Script Name: Add Audio\nScript Version: 1.4.0\nFlame Version: 2023\nWritten by: Michael Vaglienty\nCreation Date: 02.04.22\nUpdate Date: 01.20.24\n\nLicense: GNU General Public License v3.0 (GPL-3.0) - see LICENSE file for details\n\nScript Type: Batch\n\nDescription:\n\nAdd stereo or 5.1 audio to selected sequences.\n\nTo add stereo audio to a sequence, select the sequence then select the audio clip to be added.\nTo add stereo audio to multiple sequences, select in sequence/audio/sequence/audio... order.\n\nTo add 5.1 surround audio to a sequence, select the sequence followed by all the audio channels(LF, RF, C, LFE, LS, RS, Stereo)\nTo add 5.1 surround audio to multiple sequences, select in sequence/all audio channels/sequences/all audio channels... order.\n\nOrder of 5.1 surround files does not matter when being selected.\nWhen added to the sequence they will be put in this order: LF, RF, C, LFE, LS, RS, Stereo\n\n5.1 surround file names must end with _LF, _RF, _C, _LFE, _LS, _RS, or _Stereo. Case is not important.\n\nURL:\nhttps://github.com/logik-portal/python/add_audio\n\nMenus:\n\nRight-click selection of sequences and audio -> Audio -> Insert Stereo Audio - 01:00:00:00\nRight-click selection of sequences and audio -> Audio -> Insert Stereo Audio - 00:59:58:00\nRight-click selection of sequences and audio -> Audio -> Insert 5.1 Audio - 01:00:00:00\nRight-click selection of sequences and audio -> Audio -> Insert 5.1 Audio - 00:59:58:00\n\nTo install:\n\nCopy script folder into /opt/Autodesk/shared/python\n\nUpdates:\n\nv1.4.0 01.20.24\n- Updates to PySide.\n- Fixed scoping issue with Flame 2023.2+ menus.\n\nv1.3.0 90.18.23\n- Updated to pyflame lib v2.0\n\nv1.2 05.31.22\n- Messages print to Flame message window - Flame 2023.1 and later\n\nv1.1 03.15.22\n- Added new message window"
  },
  {
    "Script Name": "add dated and timed folders",
    "Script Version": "2.4.0",
    "Flame Version": "2025",
    "Maximum Flame Version": "Latest",
    "Author": "John Geehreng and Michael Vaglienty",
    "Creation Date": "07.04.20",
    "Update Date": "08.27.25",
    "Description": "Script Name: Add Dated and Timed Folders\nScript Version: 2.4.0\nFlame Version: 2025\nWritten by: John Geehreng and Michael Vaglienty\nCreation Date: 07.04.20\nUpdate Date: 08.27.25\n\nScript Type: MediaPanel/MediaHub Files\n\nDescription:\n\nCreate folders with the current date and time, date only, or time only.\n\nExamples of date formats include: YY-MM-DD, YYYY-MM-DD, YYMMDD, etc.\n\nMenus:\n\nScript Setup:\nFlame Main Menu -> Logik -> Logik Portal Script Setup -> Add Dated and Timed Folders Setup\n\nCreate Media Panel Folders:\nRight-click on library or folder -> Folders -> Add Dated and Timestamped Folders\nRight-click on library or folder -> Folders -> Add Dated Folder\nRight-click on library or folder -> Folders -> Add Timestamped Folder\n\nCreate MediaHub Files Folders:\nRight-click on folder -> Folders -> Add Dated and Timestamped Folders\nRight-click on folder -> Folders -> Add Dated Folder\nRight-click on folder -> Folders -> Add Timestamped Folder\n\nTo install:\n\nCopy script folder into /opt/Autodesk/shared/python\n\nUpdates:\n\nv2.4.0 08.27.25\n- Updated to PyFlameLib v5.0.0.\n- Escape key closes setup window.\n- Window layer order in linux is now fixed.\n- Time is now always given as four digits.\n\nv2.3.0 04.07.25\n- Updated to PyFlameLib v4.3.0.\n\nv2.2.0 12.27.24\n- Updated to PyFlameLib v4.0.0.\n- Updated SCRIPT_PATH to use absolute path. Allows script to be installed in different locations.\n\nv2.1.1 12.20.24\n- MediaHub is now refreshed after creating folders.\n\nv2.1.0 05.21.24\n- Added ability to create folders in the MediaHub Files tab.\n\nv2.0.0 04.23.24\n- Date and time formats are now customizable from the script setup:\nFlame Main Menu -> Logik -> Logik Portal Script Setup -> Add Dated and Timed Folders Setup\n\nv1.1.0 03.02.21\n- Updated to work with strftime"
  },
  {
    "Script Name": "add gmask",
    "Script Version": "2.9.0",
    "Flame Version": "2025",
    "Maximum Flame Version": "Latest",
    "Author": "Michael Vaglienty",
    "Creation Date": "01.05.20",
    "Update Date": "07.10.25",
    "Description": "Script Name: Add GMask\nScript Version: 2.9.0\nFlame Version: 2025\nWritten by: Michael Vaglienty\nCreation Date: 01.05.20\nUpdate Date: 07.10.25\n\nLicense: GNU General Public License v3.0 (GPL-3.0) - see LICENSE file for details\n\nScript Type: Batch\n\nDescription:\n\nAdds right-click menu to batch to add GMask or GMask Tracer node to batch\n\nURL:\nhttps://github.com/logik-portal/python/add_gmask\n\nMenus:\n\nRight click anywhere in batch or on any node with a matte input -> Add GMask... -> Add GMask Tracer Node\n\nRight click anywhere in batch or on any node with a matte input -> Add GMask... -> Add GMask Node\n\nTo install:\n\nCopy script folder into /opt/Autodesk/shared/python\n\nUpdates:\n\nv2.9.0 07.10.25\n- Updated to PyFlameLib v5.0.0.\n\nv2.8.0 04.03.25\n- Updated to PyFlameLib v4.3.0.\n\nv2.7.0 12.27.24\n- Updated to PyFlameLib v4.0.0.\n- Updated SCRIPT_PATH to use absolute path. Allows script to be installed in different locations.\n- Script now only works with Flame 2023.2+.\n\nv2.6.0 07.22.24\n- Updated to PyFlameLib v3.0.0.\n\nv2.5.1 01.15.24\n- Updated PySide.\n\nv2.5.0 07.24.23\n- Updated to PyFlameLib v2.0.0.\n- Updated versioning to semantic versioning.\n\nv2.4 02.04.23\n- Force order of menu items in Flame 2023.2+.\n\nv2.3 05.24.22\n- Messages print to Flame message window - Flame 2023.1 and later.\n\nv2.2 03.16.22\n- Fixed float position error in 2022.3.\n\nv2.1 05.19.21\n- Updated to be compatible with Flame 2022/Python 3.7.\n\nv1.1 05.08.21\n- Gmask nodes can now be added loose in batch at cursor position."
  },
  {
    "Script Name": "add mux",
    "Script Version": "2.6.0",
    "Flame Version": "2025",
    "Maximum Flame Version": "Latest",
    "Author": "Michael Vaglienty",
    "Creation Date": "07.31.19",
    "Update Date": "07.10.25",
    "Description": "Script Name: Add Mux\nScript Version: 2.6.0\nFlame Version: 2025\nWritten by: Michael Vaglienty\nCreation Date: 07.31.19\nUpdate Date: 07.10.25\n\nLicense: GNU General Public License v3.0 (GPL-3.0) - see LICENSE file for details\n\nScript Type: Batch\n\nDescription:\n\nAdd regular mux node or frame locked mux to batch.\n\nRight-click on an existing node to add connected mux node after it.\n\nURL:\nhttps://github.com/logik-portal/python/add_mux\n\nMenus:\n\nRight-click in batch -> Add Mux... -> Add MUX\nRight-click in batch -> Add Mux... -> Add Freeze Frame MUX\n\nRight-click on node in batch -> Add Mux... -> Add MUX\nRight-click on node in batch -> Add Mux... -> Add Freeze Frame MUX\n\nRight-click on Mux node in batch -> Add Mux... -> Freeze Selected MUX\n\nTo install:\n\nCopy script folder into /opt/Autodesk/shared/python\n\nUpdates:\n\nv2.6.0 07.10.25\n- Updated to PyFlameLib v5.0.0.\n\nv2.5.0 04.03.25\n- Updated to PyFlameLib v4.3.0.\n\nv2.4.0 01.07.25\n- Updated to PyFlameLib v4.0.0.\n\nv2.3.1 01.15.24\n- Updated PySide.\n\nv2.3.0 07.24.23\n- Updated to pyflame lib v2.0.0.\n- Updated versioning to semantic versioning.\n\nv2.2 05.24.22\n- Messages print to Flame message window - Flame 2023.1 and later.\n\nv2.1 05.19.21\n- Updated to be compatible with Flame 2022/Python 3.7.\n\nv1.6 05.12.21\n- Mux node can now be added at cursor position.\n- Regular MUX can now be added.\n\nv1.5 02.10.20\n- Freeze existing mux at current frame."
  },
  {
    "Script Name": "adjust text fx",
    "Script Version": "2.10.0",
    "Flame Version": "2023.2",
    "Maximum Flame Version": "Latest",
    "Author": "Michael Vaglienty",
    "Creation Date": "05.08.20",
    "Update Date": "04.12.25",
    "Description": "Script Name: Adjust Text FX\nScript Version: 2.10.0\nFlame Version: 2023.2\nWritten by: Michael Vaglienty\nCreation Date: 05.08.20\nUpdate Date: 04.12.25\n\nLicense: GNU General Public License v3.0 (GPL-3.0) - see LICENSE file for details\n\nScript Type: Timeline\n\nDescription:\n\nInteractively adjust timeline text fx settings that can then be applied to all selected timeline text fx\n\nURL:\nhttps://github.com/logik-portal/python/adjust_text_fx\n\nMenu:\n\nRight-click on selected clips on timeline with text fx -> Adjust Text FX\n\nTo install:\n\nCopy script folder into /opt/Autodesk/shared/python\n\nUpdates:\n\nv2.10.0 04.12.25\n- Updated to PyFlameLib v4.3.0.\n\nv2.9.0 12.30.24\n- Updated to PyFlameLib v4.0.0.\n- Updated SCRIPT_PATH to use absolute path. Allows script to be installed in different locations.\n\nv2.8.0 08.12.24\n- Updated to PyFlameLib v3.0.0.\n\nv2.7.0 01.30.24\n- Updates to UI/PySide.\n- Updated to PyFlameLib v2.0.0\n- Updated script versioning to semantic versioning.\n\nv2.6 03.23.23\n- Added ability to select different font types to the file browser for 2022 - 2022.3.\n\nv2.5 03.13.23\n- Added check to make sure script is installed in the correct location.\n- Misc bug fixes.\n\nv2.4 10.31.22\n- Updated menu for Flame 2023.2+\n\nv2.3 07.23.22\n- Messages print to Flame message window - Flame 2023.1 and later\n- Added Flame file browser - Flame 2023.1 and later\n\nv2.2 03.18.22\n- Moved UI widgets to external file\n\nv2.1 02.25.22\n- Updated UI for Flame 2023\n\nv2.0 05.22.21\n- Updated to be compatible with Flame 2022/Python 3.7\n\nv1.4 02.17.21\n- Multiple text layers can now be repositioned properly\n- Fixes to slider calculator\n\nv1.3 02.06.21\n- Misc slider calculator fixes\n- Converted UI elements to classes"
  },
  {
    "Script Name": "alternating colors",
    "Script Version": "1.0.0",
    "Flame Version": "2025.1",
    "Maximum Flame Version": "Latest",
    "Author": "Bryan Bayley",
    "Creation Date": "08.14.24",
    "Update Date": "08.14.24",
    "Description": "Script Name: Alternating Colours\nScript Version: 1.0.0\nFlame Version: 2025.1\nWritten by: Bryan Bayley\nCreation Date: 08.14.24\n\nScript Type: MediaPanel\n\nDescription:\n\nFor any group of items selected in the Media Panel you can apply an alternating colour scheme (light/dark versions of the color you select).\n\nOnly works when the items selected are the same type (Clip, Reel, Folder, etc.)\n\nMenus:\n\nRight-click in Media Panel -> Alternating Colors\n\nTo install:\n\nCopy script folder into /opt/Autodesk/shared/python\n\nUpdates:\n\nv1.0.0 08.14.24\n- Initial release."
  },
  {
    "Script Name": "apply text timeline fx to segments",
    "Script Version": "3.0.0",
    "Flame Version": "2025",
    "Maximum Flame Version": "Latest",
    "Author": "Kieran Hanrahan",
    "Creation Date": "06.23.23",
    "Update Date": "03.04.25",
    "Description": "Script Name: Apply Text TimelineFX to Segments\nWritten By: Kieran Hanrahan\n\nScript Version: 3.0.0\nFlame Version: 2025\n\nURL: http://github.com/khanrahan/apply-text-timelinefx-to-segments\n\nCreation Date: 06.23.23\nUpdate Date: 03.04.25\n\nDescription:\n\nFind specific segments in the selected sequences then apply Text TimelineFX and load\nText setups based on a token pattern.\n\nPut simply... its for loading text setups in bulk!\n\nMenus:\n\nRight-click selected items on the Desktop --> Apply... --> Text TimelineFX to Segments\n\nRight-click selected items in the Media Panel --> Apply... --> Text TimelineFX to Segments\n\nTo Install:\n\nFor all users, copy this file to:\n/opt/Autodesk/shared/python/\n\nFor a specific user on Linux, copy this file to:\n/home/<user_name>/flame/python/\n\nFor a specific user on Mac, copy this file to:\n/Users/<user_name>/Library/Preferences/Autodesk/flame/python/"
  },
  {
    "Script Name": "auto scale xmls",
    "Script Version": "1.0.0",
    "Flame Version": "2025",
    "Maximum Flame Version": "Latest",
    "Author": "John Geehreng",
    "Creation Date": "12.06.24",
    "Update Date": "10.22.25",
    "Description": "Script Name: auto_scale_xmls\nScript Version: 1.0.0\nFlame Version: 2025\nWritten by: John Geehreng\nCreation Date: 12.06.24\nUpdate Date: 10.22.25\n\nScript Type: MediaPanel\n\nDescription:\n\nThe goal is to be able to select multiple xmls that have been run through the fix premiere xmls script at various resolutions using a json file.\n\nMenus:\n\nMedia Panel -> UC Timelines -> Auto Scale XML's\n\nTo install:\n\nCopy script into your python folder, typically /opt/Autodesk/shared/python/auto_scale_xmls or wherever you keep your scripts\n\nUpdates:\n\nv1.0.0 10.22.25\n\nuse flame.projects.current_project.project_folder to determine where to save json's and action's\n\nv0.7 12.27.24\n\ncustomized for Uppercut\n\nv0.6 12.27.24\n\nAdded Build Resolution list options\n\nv0.5 12.18.24\n\nadded Track and Segment checks. made folder names more flexible\n\nv0.4 12.14.24\n\nAssumes there aren't multiple versions in the xmls\n\nv0.3 12.09.24\n\nAdded script_path = os.path.abspath(os.path.dirname(__file__)) for centralized workflows\n\nv0.2 12.09.24\n\nDeleting the actions, creating new ones, and loading the target action seems to fix the resize/xml bug. (Lines 273 - 275)\n\nv0.1 12.06.24\n\nInception"
  },
  {
    "Script Name": "axis to point locators",
    "Script Version": "1.5.0",
    "Flame Version": "2023.2",
    "Maximum Flame Version": "Latest",
    "Author": "Michael Vaglienty",
    "Creation Date": "11.12.21",
    "Update Date": "04.03.25",
    "Description": "Script Name: Axis to Point Locators\nScript Version: 1.5.0\nFlame Version: 2023.2\nWritten by: Michael Vaglienty\nCreation Date: 11.12.21\nUpdate Date: 04.03.25\n\nLicense: GNU General Public License v3.0 (GPL-3.0) - see LICENSE file for details\n\nScript Type: Action\n\nDescription:\n\nConvert selected axis nodes to point locators\n\nURL:\nhttps://github.com/logik-portal/python/axis_to_point_locators\n\nMenu:\n\nRight-click on axis node -> Axis to Point Locator\n\nTo install:\n\nCopy script folder into /opt/Autodesk/shared/python\n\nUpdates:\n\nv1.5.0 04.03.25\n- Updated to PyFlameLib v4.3.0.\n\nv1.4.0 12.28.24\n- Updated to PyFlameLib v4.0.0.\n- Updated SCRIPT_PATH to use absolute path. Allows script to be installed in different locations.\n- Script now only works with Flame 2023.2+.\n\nv1.3.0 08.04.24\n- Updated to PyFlameLib v3.0.0.\n\nv1.2.2 05.17.24\n- Fixed: Point locators not in proper position.\n\nv1.2.1 01.15.24\n- Updated PySide.\n\nv1.2.0 07.29.23\n- Updated to PyFlameLib v2.0.0.\n\nv1.1 01.04.23:\n- Updated menu for Flame 2023.2+"
  },
  {
    "Script Name": "batch nodes",
    "Script Version": "3.11.0",
    "Flame Version": "2025",
    "Maximum Flame Version": "Latest",
    "Author": "Michael Vaglienty",
    "Creation Date": "04.18.20",
    "Update Date": "07.10.25",
    "Description": "Script Name: Batch Nodes\nScript Version: 3.11.0\nFlame Version: 2025\nWritten by: Michael Vaglienty\nCreation Date: 04.18.20\nUpdate Date: 07.10.25\n\nLicense: GNU General Public License v3.0 (GPL-3.0) - see LICENSE file for details\n\nScript Type: Batch / Flame Main Menu\n\nDescription:\n\n*** Does not work with Flame 2024.0 due to bug in Flame ***\n\nAdd menus to batch right-click for your favorite nodes.\n\nWorks with standard batch nodes/matchboxes/ofx.\n\nOFX can only be added by right clicking on an existing node in batch.\n\nNodes added by right-clicking on them in batch will be saved with current settings.\n\nAll created node menu scripts are saved in /opt/Autodesk/user/YOURUSER/python/batch_node_menus\n\nMenus:\n\nTo create/rename/delete menus from node lists:\nFlame Main Menu -> Logik -> Logik Portal Script Setup -> Batch Nodes Setup\n\nTo create menus for nodes with settings applied in batch:\nRight-click on node in batch -> Batch Nodes... -> Create Menu For Selected Node\n\nTo create menus for ofx nodes:\nRight-click on node in batch -> Batch Nodes... -> Create Menu For Selected Node\n\nTo add node from menu to batch:\nRight-click in batch -> Batch Nodes... -> Select Node to be added\n\nURL:\nhttps://github.com/logik-portal/python/batch_nodes\n\nTo add node from menu to batch connected to selected node:\nRight-click on node in batch -> Batch Nodes... -> Select Node to be added\n\nTo install:\n\nCopy script folder into /opt/Autodesk/shared/python\n\nUpdates:\n\nv3.11.0 07.10.25\n- Updated to PyFlameLib v5.0.0.\n- Bug fixes to batch nodes menu.\n- Window layer order in linux is now fixed.\n\nv3.10.0 03.11.25\n- Updated to PyFlameLib v4.3.0.\n- Fixed misc bugs.\n\nv3.9.0 01.04.25\n- Updated to PyFlameLib v4.0.0.\n- Updated SCRIPT_PATH to use absolute path. Allows script to be installed in different locations.\n- Script now only works with Flame 2023.2+.\n\nv3.8.0 08.14.24\n- Updated to PyFlameLib v3.0.0.\n\nv3.7.0 01.21.24\n- Updates to UI/PySide.\n\nv3.6.0 08.13.23\n- Updated to PyFlameLib v2.0.0.\n\nv3.5.1 06.28.23\n- Updated version naming to semantic versioning.\n- Main window tabs no longer have outline around names when selected in linux.\n\nv3.5 02.04.23\n- Updated menus for Flame 2023.2+\n- Updated config file loading/saving.\n- Added check to make sure script is installed in the correct location.\n\nv3.4 05.31.22\n- Messages print to Flame message window - Flame 2023.1+\n- Flame file browser used to select folders - Flame 2023.1+\n- Misc bug fixes.\n\nv3.3 03.31.22\n- UI widgets moved to external file\n- Misc bug fixes\n\nv3.2 03.07.22\n- Updated UI for Flame 2023\n\nv3.1 10.26.21\n- Updated config to xml\n\nv3.0 05.20.21\n- Updated to be compatible with Flame 2022/Python 3.7\n\nv2.5 01.27.21\n- Updated UI\n- Menus/Nodes can be renamed after they've been added\n\nv2.1 05.17.20:\n- Misc code updates"
  },
  {
    "Script Name": "batch rendertimer",
    "Script Version": "1.0.0",
    "Flame Version": "2023",
    "Maximum Flame Version": "Latest",
    "Author": "Bob Maple",
    "Creation Date": "08.04.23",
    "Update Date": "08.04.23",
    "Description": "Script Name: Batch Rendertimer\nScript Version: 1.0.0\nFlame Version: 2023\nWritten by: Bob Maple\nCreation Date: 08.04.23\nUpdate Date: 08.04.23\n\nScript Type: Batch Rendering\n\nDescription:\n\nPrints render start and end times to the console and to the Flame message area.\n\nTo install:\n\nCopy script folder into /opt/Autodesk/shared/python"
  },
  {
    "Script Name": "build resolution list",
    "Script Version": "1.0.0",
    "Flame Version": "2025",
    "Maximum Flame Version": "Latest",
    "Author": "John Geehreng",
    "Creation Date": "12.20.24",
    "Update Date": "10.22.25",
    "Description": "Script Name: Build Resolution List\nScript Version: 1.0.0\nFlame Version: 2025\nWritten by: John Geehreng\nCreation Date: 12.20.24\nUpdate Date: 10.22.25\n\nScript Type: MediaPanel\n\nDescription:\n\nThe goal is to be able to select multiple xmls that have been run through the fix premiere xmls script at various resolutions using a json file.\n\nMenu:\n\nMedia Panel -> UC Timelines -> Build Resolution List\n\nTo install:\n\nCopy script folder into /opt/Autodesk/shared/python\n\nUpdates:\n\nv1.0.0   10.22.25\n- Use flame.projects.current_project.project_folder to determine where to save json's\n\nv0.2   12.27.24\n- Added aspect ratio to json file\n\nv0.1   12.20.24\n- Initial release."
  },
  {
    "Script Name": "clip to batch group",
    "Script Version": "2.7.0",
    "Flame Version": "2025",
    "Maximum Flame Version": "Latest",
    "Author": "Michael Vaglienty",
    "Creation Date": "06.16.19",
    "Update Date": "04.09.25",
    "Description": "Script Name: Clip to Batch Group\nScript Version: 2.7.0\nFlame Version: 2025\nWritten by: Michael Vaglienty\nCreation Date: 06.16.19\nUpdate Date: 04.09.25\n\nLicense: GNU General Public License v3.0 (GPL-3.0) - see LICENSE file for details\n\nScript Type: MediaPanel / Media Hub\n\nDescription:\n\nImport selected clips from the mediahub into newly created batch groups set to clip length with a render node\n\nOption to switch to batch tab when batch groups are done being created can be\nturned off and on. Edit the following line in the __init__ section to either be True or False:\n\nself.go_to_batch = False\n\nAdditional naming can be added to the end of batch group names. Edit the following line\nin the __init__ section. Naming must be in quotes.\n\nself.additional_naming = '_comp'\n\nNames of the batch group reels that are created by default can be\nchanged by editing these two lists in the __init__ section:\n\nschematic_reel_list = [\n'Elements',\n'Plates',\n'PreRenders',\n'Ref',\n]\n\nshelf_reel_list = [\n'Renders',\n]\n\nURL:\nhttps://github.com/logik-portal/python/clip_to_batch_group\n\nMenus:\n\nTo import clips into batch group with shot name extracted from clip name:\nRight-click on clip in MediaHub -> Import... -> Create New Batch Group - Shot Name\nRight-click on clip in MediaHub -> Import... -> Create New Batch Group - Shot Name - All Clips One Batch\n\nTo import clips into batch group with clip name:\nRight-click on clip in MediaHub -> Import... -> Create New Batch Group - Clip Name\nRight-click on clip in MediaHub -> Import... -> Create New Batch Group - Clip Name - All Clips One Batch\n\nTo create batch group from clips in media panel with shot name extracted from clip name:\nRight-click on clip in Media Panel -> Create New Batch Group... -> Shot Name\n\nTo create batch group from clips in media panel with clip name:\nRight-click on clip in Media Panel -> Create New Batch Group... -> Clip Name\n\nTo install:\n\nCopy script into /opt/Autodesk/shared/python/clip_to_batch_group\n\nUpdates:\n\nv2.7.0 04.09.25\n- Updated to PyFlameLib v4.3.0.\n\nv2.6.0 01.15.25\n- Updated to PyFlameLib v4.1.0.\n- Script now only works with Flame 2025+.\n\nv2.5.0 08.22.24\n- Updated to PyFlameLib v3.0.0.\n\nv2.4.0 04.27.24\n- Render node now sets in and out marks based on clip in and out marks.\n\nv2.3.0 01.21.24\n- Sequences can now be imported into batch groups. This caused an error before.\n- Updates to PySide.\n\nv2.2.0 09.12.23\n- When creating a batch group from a clip in the media panel, the script will check for a shot name assigned to the clip.\n- If a shot name is assigned, that will be used for the batch group name. If no shot name is assigned, the script will\nattempt to extract the shot name from the clip name.\n- Updated with PyFlameLib v2.\n\nv2.1 05.19.21\n- Updated to be compatible with Flame 2022/Python 3.7.\n\nv1.8 05.15.21\n- Properly names batch group with shot name when clip name starts with number - 123_030_bty_plate -> 123_030_comp\n\nv1.7 02.19.21\n- Option added to switch to batch tab or not when batch groups are create can be toggled\nby editing self.go_to_batch value in __init__. Must be True or False.\n- Mediahub menu options added to import all selected clips into one batch group. Clip selected first is\nplate used for shot length and timecode.\n\nv1.6 11.18.20\n- Added Mux nodes with context 1 and 2 preset.\n\nv1.5 09.10.20\n- Batch groups can now be imported and named after either the clip name or shot name.\n- Script will now switch to the Batch tab when creating a batch group from the media panel - caused an error before.\n\nv1.4 04.20.20\n- Added ability to create batchgroup from clip in Media Panel.\n- Right-click on clip in Media Panel -> Clips... -> Create New Batchgroup\n\nv1.3 11.01.19\n- Changed menu name to Import...\n- Render node takes frame rate from imported clip\n\nv1.1 08.13.19\n- Code cleanup."
  },
  {
    "Script Name": "color segment fx",
    "Script Version": "1.4.0",
    "Flame Version": "2025",
    "Maximum Flame Version": "Latest",
    "Author": "Michael Vaglienty",
    "Creation Date": "03.02.24",
    "Update Date": "07.10.25",
    "Description": "Script Name: Color Segment FX\nScript Version: 1.4.0\nFlame Version: 2025\nWritten by: Michael Vaglienty\nCreation Date: 03.02.24\nUpdate Date: 07.10.25\n\nLicense: GNU General Public License v3.0 (GPL-3.0) - see LICENSE file for details\n\nScript Type: Timeline\n\nDescription:\n\nColors segments on selected sequence with selected FX type.\n\nURL:\nhttps://github.com/logik-portal/python/color_segment_fx\n\nMenus:\n\nRight-Click on Sequence in Media Panel -> Color Timeline FX\n\nTo install:\n\nCopy script folder into /opt/Autodesk/shared/python\n\nUpdates:\n\nv1.4.0 07.10.25\n- Updated to PyFlameLib v5.0.0.\n- Escape key closes main window.\n- Window layer order in linux is now fixed.\n\nv1.3.0 03.16.25\n- Updated to PyFlameLib v4.3.0.\n- Added 'No Color' option to color menu and removed 'Remove Color' button.\n\nv1.2.0 12.27.24\n- Updated to PyFlameLib v4.0.0.\n- Updated SCRIPT_PATH to use absolute path. Allows script to be installed in different locations.\n\nv1.1.0 08.05.24\n- Updated to PyFlameLib v3.0.0."
  },
  {
    "Script Name": "connect crypto",
    "Script Version": "0.5",
    "Flame Version": "2021",
    "Maximum Flame Version": "Latest",
    "Author": "Kyle Obley (info@kyleobley.com)",
    "Creation Date": "07.05.23",
    "Update Date": "02.26.24",
    "Description": "Script Name: Connect Cryptomatte\nScript Version: 0.5\nFlame Version: 2021\n\nCreation date: 07.05.23\nModified date: 02.26.24\n\nAuthor: Kyle Obley (info@kyleobley.com)\n\nDescription:\n\nCreates and connects a Cryptomatte node to a read file node if it's a cryptomatte.\n\nChange Log:\n\nv0.5: Completely changed logic to use node.output_sockets which removes the need to try channels, etc.\nThis hopefully makes the script bulletproof.\n\nv0.4: Added support for channels coming out without the filename within the channel itself.\n\nv0.3: Added support for Houdini's Object ID naming\n\nv0.2: Added logic for different channel names and support for CryptoMesh\n\nv0.1: Initial Release"
  },
  {
    "Script Name": "continue folder",
    "Script Version": "3.0.0",
    "Flame Version": "2025",
    "Maximum Flame Version": "Latest",
    "Author": "Kieran Hanrahan",
    "Creation Date": "04.10.23",
    "Update Date": "03.06.25",
    "Description": "Script Name: Continue Folder\nWritten By: Kieran Hanrahan\n\nScript Version: 3.0.0\nFlame Version:  2025\n\nURL: http://www.github.com/khanrahan/continue-folder\n\nCreation Date: 04.10.23\nUpdate Date: 03.06.25\n\nDescription:\n\nCreate a new reel on the Desktop and/or folder in the MediaHub Files tab using\ntokens, including a token to continue a number sequence in a sequence of existing\nfolders.\n\nMenus:\n\nRight-click selected folders in the Media Hub --> Create... --> Continue Folder\n\nTo Install:\n\nFor all users, copy this file to:\n/opt/Autodesk/shared/python/\n\nFor a specific user on Linux, copy this file to:\n/home/<user_name>/flame/python/\n\nFor a specific user on Mac, copy this file to:\n/Users/<user_name>/Library/Preferences/Autodesk/flame/python/"
  },
  {
    "Script Name": "copy dir listing to clipboard",
    "Script Version": "2.0.0",
    "Flame Version": "2025",
    "Maximum Flame Version": "Latest",
    "Author": "Kieran Hanrahan",
    "Creation Date": "11.01.22",
    "Update Date": "03.06.25",
    "Description": "Script Name: Copy Directory Listing to Clipboard\nWritten By: Kieran Hanrahan\n\nScript Version: 2.0.0\nFlame Version: 2025\n\nURL: http://github.com/khanrahan/copy-dir-listing-to-clipboard\n\nCreation Date: 11.01.22\nUpdate Date: 03.06.25\n\nDescription:\n\nTakes the selected folders in the Media Hub, gets a listing of the directory,\nand copies the output to the clipboard.\n\nMenus:\n\nRight-click a folder in the Media Hub Files --> Copy... --> Directory Listing (by Date) to Clipboard\n\nRight-click a folder in the Media Hub Files --> Copy... --> Directory Listing (by Name) to Clipboard\n\nTo Install:\n\nFor all users, copy this file to:\n/opt/Autodesk/shared/python/\n\nFor a specific user on Linux, copy this file to:\n/home/<user_name>/flame/python/\n\nFor a specific user on Mac, copy this file to:\n/Users/<user_name>/Library/Preferences/Autodesk/flame/python/"
  },
  {
    "Script Name": "copy filepath to clipboard",
    "Script Version": "1.3.1",
    "Flame Version": "2025",
    "Maximum Flame Version": "Latest",
    "Author": "Kieran Hanrahan",
    "Creation Date": "04.07.25",
    "Update Date": "11.21.25",
    "Description": "Script Name: Copy Filepath to Clipboard\nWritten by: Kieran Hanrahan\n\nScript Version: 1.3.1\nFlame Version: 2025\n\nURL: http://github.com/khanrahan/copy-filepath-to-clipboard\n\nCreation Date: 04.07.25\nUpdate Date: 11.21.25\n\nDescription:\n\nCopy the filepaths of the selected items.\n\nMenus:\n\nRight-click selected items on the Desktop > Copy... > Filepath to Clipboard\nRight-click selected items in the MediaHub > Copy... > Filepath to Clipboard\nRight-click selected items in the Media Panel > Copy... > Filepath to Clipboard\nRight-click selected items in the Timeline > Copy... > Filepath to Clipboard\n\nTo Install:\n\nFor all users, copy this file to:\n/opt/Autodesk/shared/python/\n\nFor a specific user on Linux, copy this file to:\n/home/<user_name>/flame/python/\n\nFor a specific user on Mac, copy this file to:\n/Users/<user_name>/Library/Preferences/Autodesk/flame/python/"
  },
  {
    "Script Name": "copy location",
    "Script Version": "3.0.0",
    "Flame Version": "2025",
    "Maximum Flame Version": "Latest",
    "Author": "Kieran Hanrahan",
    "Creation Date": "04.21.23",
    "Update Date": "03.06.25",
    "Description": "Script Name: Copy Location\nWritten By: Kieran Hanrahan\n\nScript Version: 3.0.0\nFlame Version: 2025\n\nURL: http://github.com/khanrahan/copy-location\n\nCreation Date: 04.21.23\nUpdate Date: 03.06.25\n\nDescription:\n\nCopy location of item inside of Flame (as opposed to the path in the file system).\n\nAvailable for the following items:\n\nBatch Groups\nBatch Iterations\nClips\nDesktops\nFolders\nLibraries\nReels\nReel Groups\nSequences\n\nMenus:\n\nRight-click selected items on the Desktop --> Copy... --> Location to Clipboard\nRight-click selected items in the Media Panel --> Copy... --> Location to Clipboard\n\nTo Install:\n\nFor all users, copy this file to:\n/opt/Autodesk/shared/python/\n\nFor a specific user on Linux, copy this file to:\n/home/<user_name>/flame/python/\n\nFor a specific user on Mac, copy this file to:\n/Users/<user_name>/Library/Preferences/Autodesk/flame/python/"
  },
  {
    "Script Name": "copy name to clipboard",
    "Script Version": "3.2.0",
    "Flame Version": "2025",
    "Maximum Flame Version": "Latest",
    "Author": "Kieran Hanrahan",
    "Creation Date": "10.12.23",
    "Update Date": "11.19.25",
    "Description": "Script Name: Copy Name to Clipboard\nWritten by: Kieran Hanrahan\n\nScript Version: 3.2.0\nFlame Version: 2025\n\nURL: http://www.github.com/khanrahan/copy-name-to-clipboard\n\nCreation Date: 10.12.23\nUpdate Date: 11.19.25\n\nDescription:\n\nCopy names of selected items to clipboard.\n\nMenus:\n\nRight-click selected items on the Desktop -> Copy... -> Name to Clipboard\nRight-click selected items in the Media Hub -> Copy... -> Name to Clipboard\nRight-click selected items in the Media Panel -> Copy... -> Name to Clipboard\nRight-click selected items in the Timeline -> Copy... -> Name to Clipboard\n\nTo Install:\n\nFor all users, copy this file to:\n/opt/Autodesk/shared/python/\n\nFor a specific user on Linux, copy this file to:\n/home/<user_name>/flame/python/\n\nFor a specific user on Mac, copy this file to:\n/Users/<user_name>/Library/Preferences/Autodesk/flame/python/"
  },
  {
    "Script Name": "copy name to shot name",
    "Script Version": "1.0.1",
    "Flame Version": "2022",
    "Maximum Flame Version": "Latest",
    "Author": "Kieran Hanrahan",
    "Creation Date": "07.21.22",
    "Update Date": "03.06.24",
    "Description": "Script Name: Copy Segment Name to Shot Name\nWritten By: Kieran Hanrahan\n\nScript Version: 1.0.1\nFlame Version: 2022\n\nURL: http://github.com/khanrahan/copy-name-to-shot-name\n\nCreation Date: 07.21.22\nUpdate Date: 03.06.24\n\nDescription:\n\nSimple script to copy segment name to shot name on all selected segments.\n\nMenus:\n\nRight-click selected segments in a sequence -> Copy... -> Segment Name to Shot Name\n\nTo Install:\n\nFor all users, copy this file to:\n/opt/Autodesk/shared/python\n\nFor a specific user, copy this file to:\n/opt/Autodesk/user/<user name>/python"
  },
  {
    "Script Name": "copy positioner timecode to clipboard",
    "Script Version": "2.0.0",
    "Flame Version": "2025",
    "Maximum Flame Version": "Latest",
    "Author": "Kieran Hanrahan",
    "Creation Date": "02.25.24",
    "Update Date": "04.17.24",
    "Description": "Script Name: Copy Positioner Timecode to Clipboard\nWritten By: Kieran Hanrahan\n\nScript Version: 2.0.0\nFlame Version: 2025\n\nURL: http://www.github.com/khanrahan/copy-positioner-timecode-to-clipboard\n\nCreation Date: 02.25.24\nUpdate Date: 04.17.24\n\nDescription:\n\nCopy positioner timecode of selected timelines to the clipboard.\n\nMenus:\n\nRight-click selected items on the Desktop -> Copy... -> Positioner Timecode to Clipboard\n\nRight-click selected items in the Media Hub -> Copy... -> Positioner Timecode to Clipboard\n\nTo Install:\n\nFor all users, copy this file to:\n/opt/Autodesk/shared/python\n\nFor a specific user, copy this file to:\n/opt/Autodesk/user/<user name>/python"
  },
  {
    "Script Name": "copy shot name to clipboard",
    "Script Version": "1.0.0",
    "Flame Version": "2025",
    "Maximum Flame Version": "Latest",
    "Author": "Kieran Hanrahan",
    "Creation Date": "04.08.25",
    "Update Date": "04.08.25",
    "Description": "Script Name: Copy Shot Name to Clipboard\nWritten by: Kieran Hanrahan\n\nScript Version: 1.0.0\nFlame Version: 2025\n\nURL: http://www.github.com/khanrahan/copy-shot-name-to-clipboard\n\nCreation Date: 04.08.25\nUpdate Date: 04.08.25\n\nDescription:\n\nCopy shot names of selected items to clipboard.\n\nMenus:\n\nRight-click selected items on the Desktop -> Copy... -> Shot Name to Clipboard\nRight-click selected items in the Media Panel -> Copy... -> Shot Name to Clipboard\nRight-click selected items in a Timeline -> Copy... -> Shot Name to Clipboard\n\nTo Install:\n\nFor all users, copy this file to:\n/opt/Autodesk/shared/python/\n\nFor a specific user on Linux, copy this file to:\n/home/<user_name>/flame/python/\n\nFor a specific user on Mac, copy this file to:\n/Users/<user_name>/Library/Preferences/Autodesk/flame/python/"
  },
  {
    "Script Name": "create export menus",
    "Script Version": "5.4.0",
    "Flame Version": "2025",
    "Maximum Flame Version": "Latest",
    "Author": "Michael Vaglienty",
    "Creation Date": "03.29.20",
    "Update Date": "07.14.25",
    "Description": "Script Name: Create Export Menus\nScript Version: 5.4.0\nFlame Version: 2025\nWritten by: Michael Vaglienty\nCreation Date: 03.29.20\nUpdate Date: 07.14.25\n\nLicense: GNU General Public License v3.0 (GPL-3.0) - see LICENSE file for details\n\nScript Type: MediaPanel\n\nDescription:\n\nCreate custom right-click export menu's from saved export presets\n\nURL:\nhttps://github.com/logik-portal/python/create_export_menus\n\nMenus:\n\nTo create or edit export menus:\nFlame Main Menu -> Logik Portal -> Logik Portal Script Setup -> Create Export Menus\n\nTo access newly created menus:\nRight-click on clip -> Project Export Presets... -> Select export\nRight-click on clip -> Shared Export Presets... -> Select export\n\nTo install:\n\nCopy script folder into /opt/Autodesk/shared/python\n\nUpdates:\n\nv5.4.0 07.14.25\n- Updated to PyFlameLib v5.0.0.\n- Window layer order in linux is now fixed.\n\nv5.3.1 04.24.25\n- Hour token now gives 24 hour format.\n- Added new hour (12 Hour) token to give 12 hour format.\n\nv5.3.0 04.07.25\n- Updated to PyFlameLib v4.3.0.\n- Added confirmation window when overwriting an existing export menu.\n\nv5.2.0 01.15.25\n- Updated to PyFlameLib v4.1.0.\n- Updated SCRIPT_PATH to use absolute path. Allows script to be installed in different locations.\n- Script now only works with Flame 2023.2+.\n\nv5.1.0 08.24.24\n- Updated to PyFlameLib v3.\n\nv5.0.0 03.25.24\n- Major code cleanup.\n- Added subtitle export options to export presets.\n- Script now scans shared/project export preset subdirectories for saved export presets.\n\nv4.6.1 02.25.24\n- Misc UI Fixes.\n\nv4.6.0 01.21.24\n- Updated UI/PySide.\n- Fixed misc UI issues.\n- Fixed issue with Reveal in MediaHub/Finder buttons not updating in Edit tab.\n- Updated config file loading/saving.\n\nv4.5.0 09.03.23\n- Update to pyflame lib v2.0.0.\n*** The update to pyflame lib v2.0.0. will cause old script menus to not work. ***\n\nv4.4 04.20.23\n- Updated menus for Flame 2023.2+\n- Added 2024 preset version number.\n- Removed maximum version from preset menu template. This allows presets to be used with newer versions of Flame.\n\nv4.3 08.22.22\n- Added duplicate button to Edit tab - Duplicates selected preset\n\nv4.2 06.22.22\n- Messages print to Flame message window - Flame 2023.1 and later\n- Updated browser window for Flame 2023.1 and later\n- Setup window no longer closes after creating a new export preset\n- Menu template updated - With template importing new pyflame_lib module, error appears during flame startup when loading\nmenu presets. There errors can be ignored. Errors might be due to order flame is loading modules. Menus work fine.\n\nv4.1 03.19.22\n- Moved UI widgets to external file\n- Added confirmation window when deleting an existing preset\n\nv4.0 03.02.22\n- Updated UI for Flame 2023\n- Code optimization\n- Misc bug fixes\n\nv3.7 01.03.22\n- Shared export menus now only work with the major version of Flame they're created with. This avoids errors when using\na menu with a new version of Flame. For example a menu created with Flame 2022.2 will work with all versions\nof Flame 2022 but not 2021 or 2023. Shared export menus will now also only show up in versions of Flame that they will\nwork with.\n- Added token for Tape Name to be used if clip has a clip name assigned\n\nv3.6 11.02.21\n- Fixed shot name token translation to work with python 3.7 in menu_template\n\nv3.5 10.13.21\n- Added button to reveal export path in MediaHub after export\n- Added button to reveal export path in finder after export\n- Export shared movie/file export presets not compatible with working version of Flame are not listed in list drop downs\n- Fixed: Exporting using time tokens would create additional folders if time changed during export\n- Removed leading zero from hour token if hour less than 10.\n- Added lower case ampm token\n- Shot name token improvements\n- Shot name token will now attempt to get assigned shot name from clip before guessing from clip name\n- Added SEQNAME token\n\nv3.4 05.21.21\n- Updated to be compatible with Flame 2022/Python 3.7\n\nv3.3 05.19.21\n- Edited menus now save properly\n- Shot name token fixed to handle clip names that start with numbers\n\nv3.2 02.15.21\n- Python hooks refresh after deleting a preset\n\nv3.1 01.19.21\n- Added ability to assign multiple exports to single right-click export menu\n- Added ability to edit/rename/delete existing export presets\n- When export is done Flame with switch to export destination in the Media Hub (Flame 2021.2 of higher only)\n\nv2.1 09.19.20\n- Updated UI\n- Added Shot Name token to export path token list - Shot Name derived from clip name\n- Added Sequence Name token to export path token list - Seq Name derived from Shot Name\n- Added Batch Group Name token to export path token list - Can only be used when exporting clips from batch groups\n- Added Batch Group Shot Name token to export path token list - Can only be used when exporting clips from batch groups\n- Saved project export presets can now be found if project is not saved in the default location\n- Duplicate preset names no longer allowed - duplicate preset names cause preset not to work\n\nv2.0 04.27.20\n- New UI\n- Tokens can be used to dynamically set the export path\n- Options to choose to export in foreground, export between marks, and export top layer\n- Menus can be saved so that they're visible in current project only and\nshared between all projects\n\nv1.1 04.05.20\n- Fixed: Config path\n- Fixed: Problem when checking for project presets to delete"
  },
  {
    "Script Name": "create media panel templates",
    "Script Version": "3.9.0",
    "Flame Version": "2025",
    "Maximum Flame Version": "Latest",
    "Author": "Michael Vaglienty",
    "Creation Date": "05.01.19",
    "Update Date": "07.10.25",
    "Description": "Script Name: Create Media Panel Templates\nScript Version: 3.9.0\nFlame Version: 2025\nWritten by: Michael Vaglienty\nCreation Date: 05.01.19\nUpdate Date: 07.10.25\n\nLicense: GNU General Public License v3.0 (GPL-3.0) - see LICENSE file for details\n\nScript Type: MediaPanel\n\nDescription:\n\nCreate templates from libraries and folders in the Media Panel.\nRight-click menus will be created for each template\n\nURL:\nhttps://github.com/logik-portal/python/create_media_panel_templates\n\nMenus:\n\nTo create new template menus:\nRight-click on library or folder -> Create Template... -> Create Library Template / Create Folder Template\n\nNewly created templates:\nRight-click on library or folder -> Library/Folder Templates -> Select from saved templates\n\nTo install:\n\nCopy script folder into /opt/Autodesk/shared/python\n\nUpdates:\n\nv3.9.0 07.10.25\n- Updated to PyFlameLib v5.0.0.\n- Window layer order in linux is now fixed.\n\nv3.8.0 04.03.25\n- Updated to PyFlameLib v4.3.0.\n\nv3.7.0 01.02.25\n- Updated to PyFlameLib v4.0.0.\n- Updated SCRIPT_PATH to use absolute path. Allows script to be installed in different locations.\n- Script now only works with Flame 2023.2+.\n\nv3.6.0 08.24.24\n- Updated to PyFlameLib v3.0.0.\n\nv3.5.0 01.02.24\n- Updates to UI/PySide.\n\nv3.4.0 08.19.23\n- Fixed creating menus for libraries/folders with periods in name.\nPeriods are now replaced with underscores in menu file name.\n- Updated to PyFlameLib v2.0.0.\n- Updated to semantic versioning.\n\nv3.3 07.12.22\n- Messages print to Flame message window - Flame 2023.1 and later\n\nv3.2 03.15.22\n- Moved UI widgets to external file\n\nv3.1 03.07.22\n- Updated UI for Flame 2023"
  },
  {
    "Script Name": "create projection",
    "Script Version": "2.10.0",
    "Flame Version": "2025",
    "Maximum Flame Version": "Latest",
    "Author": "Michael Vaglienty",
    "Creation Date": "07.09.19",
    "Update Date": "07.10.25",
    "Description": "Script Name: Create Projection\nScript Version: 2.10.0\nFlame Version: 2025\nWritten by: Michael Vaglienty\nCreation Date: 07.09.19\nUpdate Date: 07.10.25\n\nLicense: GNU General Public License v3.0 (GPL-3.0) - see LICENSE file for details\n\nScript Type: Flame Main Menu\n\nDescription:\n\nCreate projector or diffuse projections in Action from selected action layer.\n\nAction must have another camera added other than just the default camera.\n\nURL:\nhttps://github.com/logik-portal/python/create_projection\n\nMenus:\n\nRight-click on Action surface or geo  -> Create Projection... -> Projector Projection\nRight-click on Action surface or geo  -> Create Projection... -> Projector Light-Linked Projection\nRight-click on Action surface or geo  -> Create Projection... -> Diffuse Projection\n\nTo install:\n\nCopy script folder into /opt/Autodesk/shared/python\n\nUpdates:\n\nv2.10.0 07.10.25\n- Updated to PyFlameLib v5.0.0.\n\nv2.9.0 04.03.25\n- Updated to PyFlameLib v4.3.0.\n\nv2.8.0 12.31.24\n- Updated to PyFlameLib v4.0.0.\n- Updated SCRIPT_PATH to use absolute path. Allows script to be installed in different locations.\n- Script now only works with Flame 2023.2+.\n\nv2.7.0 07.22.24\n- Updated to PyFlameLib v3.0.0.\n\nv2.6.0 01.19.24\n- Updates to PySide.\n\nv2.5.0 07.29.23\n- Updated to PyFlameLib v2.\n- Updated to semantic versioning.\n\nv2.4 05.26.22\n- Messages print to Flame message window - Flame 2023.1 and later\n\nv2.3 03.15.22\n- Updated UI for Flame 2023\n- Moved UI widgets to external file\n\nv2.2 01.14.22\n- Added message when default camera is selected and should be changed to 3d camera\n\nv2.1 11.15.21\n- Fixed problem creating projections when Media Layer is selected instead of Action Node\n\nv2.0 05.22.21\n- Updated to be compatible with Flame 2022/Python 3.7\n\nv1.6 05.16.21\n- Error when creating projection while not having action node selected fixed\n\nv1.5 05.10.20\n- Fixed problem with diffuse not switching to new frame camera in Flame 2020.2 and up.\n\nv1.4 10.21.19\n- Changed menu to Create Projection...\n\nv1.3 09.15.19\n- Code Cleanup"
  },
  {
    "Script Name": "create shot folders",
    "Script Version": "5.4.0",
    "Flame Version": "2025.1",
    "Maximum Flame Version": "Latest",
    "Author": "Michael Vaglienty",
    "Creation Date": "06.09.18",
    "Update Date": "08.27.25",
    "Description": "Script Name: Create Shot Folders\nScript Version: 5.4.0\nFlame Version: 2025.1\nWritten by: Michael Vaglienty\nCreation Date: 06.09.18\nUpdate Date: 08.27.25\n\nLicense: GNU General Public License v3.0 (GPL-3.0) - see LICENSE file for details\n\nScript Type: MediaPanel\n\nDescription:\n\nCreate shot folders in the Media Panel and/or file system based on folder structure templates.\n\nCustom folder structure templates can be set up in the script setup window.\n\nURL:\nhttps://github.com/logik-portal/python/create_shot_folders\n\nMenus:\n\nScript Setup:\nFlame Main Menu -> Logik -> Logik Portal Script Setup -> Create Shot Folders Setup\n\nMedia Panel:\nRight-click in Media Panel -> Create Shot Folders\n\nTo install:\n\nCopy script folder into /opt/Autodesk/shared/python\n\nUpdates:\n\nv5.4.0 08.27.25\n- Updated to PyFlameLib v5.0.0.\n- Escape key closes out of windows.\n- Fixed: Reveal in Finder button was not disabled when File System Folders button was unchecked.\n\nv5.3.0 04.03.25\n- Updated to PyFlameLib v4.3.0.\n\nv5.2.0 01.02.25\n- Updated to PyFlameLib v4.1.0.\n- Updated SCRIPT_PATH to use absolute path. Allows script to be installed in different locations.\n- Script now only works with Flame 2025.1+.\n\nv5.1.0 10.01.24\n- Updated to PyFlameLib v3.2.0.\n\nv5.0.1 09.15.24\n- Shot Folder top level item in folder tree can no longer be edited.\n\nv5.0.0 09.09.24\n- Split off from Create Shot script.\n- Updated to PyFlameLib v3.0.0."
  },
  {
    "Script Name": "csv to markers",
    "Script Version": "1.3",
    "Flame Version": "2022",
    "Maximum Flame Version": "Latest",
    "Author": "Andy Milkis, Jacob Silberman-Baron, John Geehreng",
    "Creation Date": "07.11.22",
    "Update Date": "11.07.22",
    "Description": "Script Name: CSV to Markers\nScript Version: 1.3\nFlame Version: 2022\nWritten by: Andy Milkis, Jacob Silberman-Baron, John Geehreng\nCreation Date: 07.11.22\nUpdate Date: 11.07.22\n\nDescription:\n\nImports a CSV file exported from frame.io and adds markers to a clip in flame. There is no need to modify the CSV downloaded from FrameIO.\n\nMenus:\n\nRight-click on a clip in the Media Panel --> Add Timeline Markers --> Select CSV File\nRight-click on a segment in the timeline --> Add Segment Markers --> Select CSV File\n\n\nUpdates:\n\nv1.3 (11.07.22 JG)\n- Added Flame 2023.1 Browser option, 2023.2 Print to Console message if it can't find the \"Timecode In\" header, Timeline Segment scopes,\nminimumVersion of 2022 scopes, CSV File Filters, and default path of ~/Downloads\nv1.2 (7.11.22 JS-B)\n- Removed the CSVFileSelector Object and replaced it with a generic QFileDialog"
  },
  {
    "Script Name": "delete all markers",
    "Script Version": "1.0.0",
    "Flame Version": "2022",
    "Maximum Flame Version": "Latest",
    "Author": "Kieran Hanrahan",
    "Creation Date": "10.04.25",
    "Update Date": "10.04.25",
    "Description": "Script Name: Delete All Markers\nScript Version: 1.0.0\nFlame Version: 2022\nWritten by: Kieran Hanrahan\nCreation Date: 10.04.25\nUpdate Date: 10.04.25\n\nDescription:\n\nDelete all timeline or segment markers on the selected clips or sequences.\n\nURL: http://github.com/khanrahan/delete-all-markers\n\nMenus:\n\nRight-click selected clips and/or sequences on the Desktop Reels --> Edit...\n--> Delete All Markers\n\nRight-click selected clips and/or sequences in the Media Panel --> Edit...\n--> Delete All Markers\n\nTo Install:\n\nFor all users, copy this file to:\n/opt/Autodesk/shared/python/\n\nFor a specific user on Linux, copy this file to:\n/home/<user_name>/flame/python/\n\nFor a specific user on Mac, copy this file to:\n/Users/<user_name>/Library/Preferences/Autodesk/flame/python/"
  },
  {
    "Script Name": "delete empty folders",
    "Script Version": "1.5.0",
    "Flame Version": "2023.2",
    "Maximum Flame Version": "Latest",
    "Author": "Michael Vaglienty",
    "Creation Date": "11.15.23",
    "Update Date": "07.10.25",
    "Description": "Script Name: Delete Empty Folders\nScript Version: 1.5.0\nFlame Version: 2023.2\nWritten by: Michael Vaglienty\nCreation Date: 11.15.23\nUpdate Date: 07.10.25\n\nLicense: GNU General Public License v3.0 (GPL-3.0) - see LICENSE file for details\n\nScript Type: MediaPanel\n\nDescription:\n\nDelete any empty folders in selected Library or Folder.\n\nURL:\nhttps://github.com/logik-portal/python/delete_empty_folders\n\nMenu:\n\nRight-click on Folder or Library in Media Panel -> Delete Empty Folders\n\nTo install:\n\nCopy script folder into /opt/Autodesk/shared/python\n\nUpdates:\n\nv1.5.0 07.10.25\n- Updated to PyFlameLib v5.0.0.\n\nv1.4.0 04.03.25\n- Updated to PyFlameLib v4.3.0.\n\nv1.3.0 12.31.24\n- Updated to PyFlameLib v4.0.0.\n- Updated SCRIPT_PATH to use absolute path. Allows script to be installed in different locations.\n- Script now only works with Flame 2023.2+.\n\nv1.2.0 08.09.24\n- Updated to PyFlameLib v3.0.0.\n\nv1.1.0 01.21.24\n- Updates to PySide."
  },
  {
    "Script Name": "delete empty tracks",
    "Script Version": "1.0",
    "Flame Version": "2021.1",
    "Maximum Flame Version": "Latest",
    "Author": "Fred Warren",
    "Creation Date": "07.15.21",
    "Update Date": "07.15.21",
    "Description": "Script Name: Delete Empty Tracks\nScript Version: 1.0\nFlame Version: 2021.1\nWritten by: Fred Warren\nCreation Date: 07.15.21\nUpdate Date: 07.15.21\n\nScript Type: MediaPanel\n\nDescription:\n\nThis script adds three custom actions to delete empty video and/or audio\ntracks of a <PySequence>. The minimumVersion is set to 2021.1 because\n<PySegment>.type is used.\n\nMenu:\n\nMedia Panel:\nRight-click on selected sequence -> Delete Empty Video Tracks\nRight-click on selected sequence -> Delete Empty Audio Tracks\nRight-click on selected sequence -> Delete All Empty Tracks\n\nTo install:\n\nCopy script folder into /opt/Autodesk/shared/python\n\nUpdates:\n\nv1.0 07.15.21\n- Initial release."
  },
  {
    "Script Name": "delete folders",
    "Script Version": "2.10.0",
    "Flame Version": "2025",
    "Maximum Flame Version": "Latest",
    "Author": "Michael Vaglienty",
    "Creation Date": "10.04.20",
    "Update Date": "07.10.25",
    "Description": "Script Name: Delete Folders\nScript Version: 2.10.0\nFlame Version: 2025\nWritten by: Michael Vaglienty\nCreation Date: 10.04.20\nUpdate Date: 07.10.25\n\nLicense: GNU General Public License v3.0 (GPL-3.0) - see LICENSE file for details\n\nScript Type: MediaHub - Files Tab\n\nDescription:\n\nDelete one or more folders along with contents in the MediaHub File Tab view\n\n*** WARNING - THIS WILL DELETE ALL SELECTED FOLDERS/SUBFOLDERS - THIS IS CAN NOT BE UNDONE***\n\nURL:\nhttps://github.com/logik-portal/python/delete_folders\n\nMenu:\n\nRight-click with folders selected -> Delete Selected Folders\n\nTo install:\n\nCopy script folder into /opt/Autodesk/shared/python\n\nUpdates:\n\nv2.10.0 07.10.25\n- Updated to PyFlameLib v5.0.0.\n\nv2.9.0 04.03.25\n- Updated to PyFlameLib v4.3.0.\n\nv2.8.0 12.16.24\n- Updated to PyFlameLib v3.3.0.\n- Added script install check.\n- Script now only works with Flame 2023.2+.\n- Updated SCRIPT_PATH to use absolute path. Allows script installed in different locations.\n\nv2.7.0 08.05.24\n- Updated to PyFlameLib v3.0.0.\n\nv2.6.0 01.24.24\n- Updates to PySide.\n\nv2.5.0 07.27.23\n- Updated to PyFlameLib v2.0.0.\n- Updated versioning to semantic versioning.\n\nv2.4 09.28.22\n- Updated menus for Flame 2023.2+.\n\nv2.3 05.24.22\n- Messages print to Flame message window - Flame 2023.1 and later.\n\nv2.2 03.14.22\n- Added delete confirmation\n\nv2.1 05.19.21\n- Updated to be compatible with Flame 2022/Python 3.7."
  },
  {
    "Script Name": "delete iterations",
    "Script Version": "1.6.0",
    "Flame Version": "2025",
    "Maximum Flame Version": "Latest",
    "Author": "Michael Vaglienty",
    "Creation Date": "01.23.23",
    "Update Date": "07.10.25",
    "Description": "Script Name: Delete Iterations\nScript Version: 1.6.0\nFlame Version: 2025\nWritten by: Michael Vaglienty\nCreation Date: 01.23.23\nUpdate Date: 07.10.25\n\nLicense: GNU General Public License v3.0 (GPL-3.0) - see LICENSE file for details\n\nScript Type: Batch Iterations\n\nDescription:\n\nDelete iterations from batch groups. Keeps the specified number of iterations.\n\nModified from clean_batch_iteration.py by Autodesk.\n\nSelecting a desktop will delete iterations from all batch groups in the desktop.\n\nSelecting a libraries will delete iterations from all batch groups in the library including in any folders.\n\nSelecting batch groups will delete iterations from the selected batch groups.\n\nSelecting folders will delete iterations from all batch groups in the folders.\n\nURL:\nhttps://github.com/logik-portal/python/delete_iterations\n\nMenus:\n\nRight-click on a desktop, library, batch group, or folder -> Delete Batch Iterations\n\nTo install:\n\nCopy script folder into /opt/Autodesk/shared/python\n\nUpdates:\n\nv1.6.0 07.10.25\n- Updated to PyFlameLib v5.0.0.\n- Escape key closes main window.\n\nv1.5.0 03.12.25\n- Updated to PyFlameLib v4.3.0.\n\nv1.4.0 12.27.24\n- Updated to PyFlameLib v4.0.0.\n- Script now only works with Flame 2023.2+.\n- Updated SCRIPT_PATH to use absolute path. Allows script to be installed in different locations.\n\nv1.3.0 08.04.24\n- Updated to PyFlameLib v3.0.0.\n\nv1.2.1 01.29.24\n- Fixed PySide6 errors/font in slider calculator.\n\nv1.2.0 01.21.24\n- Updated to PyFlameLib v2.\n- Updates to UI/PySide.\n\nv1.1.0 08.15.23\n- Updated to PyFlameLib v2.0.0.\n\nv1.0.1 06.29.23\n- Updated script versioning to semantic versioning.\n- Pressing return with the window open will now apply the settings."
  },
  {
    "Script Name": "encompass selected nodes",
    "Script Version": "2.8.0",
    "Flame Version": "2025",
    "Maximum Flame Version": "Latest",
    "Author": "Michael Vaglienty",
    "Creation Date": "04.22.20",
    "Update Date": "07.10.25",
    "Description": "Script Name: Encompass Selected Nodes\nScript Version: 2.8.0\nFlame Version: 2025\nWritten by: Michael Vaglienty\nCreation Date: 04.22.20\nUpdate Date: 07.10.25\n\nLicense: GNU General Public License v3.0 (GPL-3.0) - see LICENSE file for details\n\nScript Type: Batch/Action\n\nDescription:\n\nCreates compass around selected nodes in batch or action.\n\nURL:\nhttps://github.com/logik-portal/python/encompass_selected_nodes\n\nMenus:\n\nSelect nodes to encompass -> Encompass Selected Nodes\n\nTo install:\n\nCopy script folder into /opt/Autodesk/shared/python\n\nUpdates:\n\nv2.8.0 07.10.25\n- Updated to PyFlameLib v5.0.0.\n- Escape key closes main window.\n\nv2.7.0 03.20.25\n- Updated to PyFlameLib v4.3.0.\n- Added menu to set compass color.\n\nv2.6.0 12.28.24\n- Fixed: Script had errors when creating compass with name that already exists.\n- Updated to PyFlameLib v4.0.0.\n- Updated SCRIPT_PATH to use absolute path. Allows script to be installed in different locations.\n\nv2.5.0 08.04.24\n- Updated to PyFlameLib v3.0.0.\n\nv2.4.0 01.21.24\n- Updates to PySide.\n\nv2.3.0 07.27.23\n- Updated to PyFlameLib v2.0.0.\n- Updated versioning to semantic versioning.\n\nv2.2 06.09.23\n- Compass is created when pressing enter in compass name field.\n\nv2.1 10.27.22\n- Window prompts for compass name when creating compass.\n- Updated right-click menu for 2023.2+.\n\nv2.0 05.23.21\n- Updated to be compatible with Flame 2022/Python 3.7.\n\nv1.1 05.10.20\n- Added ability to encompass selected action nodes."
  },
  {
    "Script Name": "filter selection",
    "Script Version": "2.1.1",
    "Flame Version": "2025",
    "Maximum Flame Version": "Latest",
    "Author": "Kieran Hanrahan",
    "Creation Date": "03.07.25",
    "Update Date": "04.10.25",
    "Description": "Script Name: Filter Selection\nWritten by: Kieran Hanrahan\n\nScript Version: 2.1.1\nFlame Version: 2025\n\nURL: http://www.github.com/khanrahan/filter-selection\n\nCreation Date: 03.07.25\nUpdate Date: 04.10.25\n\nDescription:\n\nFilter the current selection in the Media Panel.\n\nMenus:\n\nRight-click selected items on the Desktop -> Select... -> Filter Selection\nRight-click selected items in the Media Hub -> Select... -> Filter Selection\nRight-click selected items in the Media Panel -> Select... -> Filter Selection\n\nTo Install:\n\nFor all users, copy this file to:\n/opt/Autodesk/shared/python/\n\nFor a specific user on Linux, copy this file to:\n/home/<user_name>/flame/python/\n\nFor a specific user on Mac, copy this file to:\n/Users/<user_name>/Library/Preferences/Autodesk/flame/python/"
  },
  {
    "Script Name": "find and replace",
    "Script Version": "1.7",
    "Flame Version": "2023.2",
    "Maximum Flame Version": "Latest",
    "Author": "John Geehreng",
    "Creation Date": "10.01.21",
    "Update Date": "02.27.24",
    "Description": "Script Name: find and replace\nScript Version: 1.7\nFlame Version: 2023.2\nWritten by: John Geehreng\nCreation Date: 10.01.21\nUpdate Date: 02.27.24\n\nScript Type: MediaPanel\n\nUsage:\n\nRight click a selection of clips or sequences and look for UC Renamers -> Find and Replace\n\nDescription:\n\nFind and Replaces characters in a bunch of clips or sequences.\n\nTo install:\n\nCopy script into /opt/Autodesk/shared/python/find_and_replace\n\nUpdates:\n02.27.24 - v1.7 Updated Config Settings. Fixed error when empty fields are entered\n02.12.24 - v1.6 Added Preview Window\n12.12.23 - v1.5 Updated for pyflame lib v2\n01.25.23 - v1.4 Stopped window from automatically closing upon renaming. Renamed \"Cancel\" to \"Close.\"\n08.25.22 - v1.3 2023.2 ordering\n04.19.22 - v1.2 2023 UI Updates"
  },
  {
    "Script Name": "find folder",
    "Script Version": "3.0.0",
    "Flame Version": "2025",
    "Maximum Flame Version": "Latest",
    "Author": "Kieran Hanrahan",
    "Creation Date": "07.22.22",
    "Update Date": "09.05.24",
    "Description": "Script Name: Find Folder\nScript Version: 3.0.0\nFlame Version: 2025\nWritten by: Kieran Hanrahan\nCreation Date: 07.22.22\nUpdate Date: 09.05.24\n\nDescription:\n\nSearches for a subdirectory of the current directory in the Media Hub.  Useful for\nnavigating a folder that contains many many subfolders with long names but you have\na search term that would quickly find the folder you need.\n\nURL: http://github.com/khanrahan/find-folder\n\nMenus:\n\nRight-click selected folder in Media Hub Files -> Find... -> Find Folder\n\nTo Install:\n\nFor all users, copy this file to:\n/opt/Autodesk/shared/python\n\nFor a specific user, copy this file to:\n/opt/Autodesk/user/<user name>/python"
  },
  {
    "Script Name": "find replace in name advance",
    "Script Version": "3.1.0",
    "Flame Version": "2025",
    "Maximum Flame Version": "Latest",
    "Author": "Kieran Hanrahan",
    "Creation Date": "02.21.24",
    "Update Date": "04.10.25",
    "Description": "Script Name: Find & Replace in Name Advance\nWritten By: Kieran Hanrahan\n\nScript Version: 3.1.0\nFlame Version: 2025\n\nURL: http://github.com/khanrahan/find-replace-in-name-advance\n\nCreation Date: 02.21.24\nUpdate Date: 04.10.25\n\nDescription:\n\nPerform find & replace on names of selected items.  Functions on Workspaces,\nLibraries, Desktops, Reel Groups, Reels, Folders, Sequences, Clips, and Timeline\nSegments.\n\nMenus:\n\nRight-click selected items on the Desktop --> Edit... --> Find & Replace in Name Advance\n\nRight-click selected items in the Media Panel --> Edit... --> Find & Replace in Name Advance\n\nRight-click selected items in the Timeline --> Edit... --> Find & Replace in Name Advance\n\nTo Install:\n\nFor all users, copy this file to:\n/opt/Autodesk/shared/python/\n\nFor a specific user on Linux, copy this file to:\n/home/<user_name>/flame/python/\n\nFor a specific user on Mac, copy this file to:\n/Users/<user_name>/Library/Preferences/Autodesk/flame/python/"
  },
  {
    "Script Name": "find replace in text fx",
    "Script Version": "3.0.0",
    "Flame Version": "2025",
    "Maximum Flame Version": "Latest",
    "Author": "Kieran Hanrahan",
    "Creation Date": "07.21.22",
    "Update Date": "03.06.25",
    "Description": "Script Name: Find and Replace in Text TimelineFX\nWritten by: Kieran Hanrahan\n\nScript Version: 3.0.0\nFlame Version: 2025\n\nURL: http://github.com/khanrahan/find-replace-in-text-fx\n\nCreation Date: 07.21.22\nUpdate Date: 03.06.25\n\nDescription:\n\nThis script will find a specified search string within a Text TimelineFX and\nreplace that search term with something else without having to enter the Text\neditor.\n\nWorks on segments or sequences containing Text TimelineFX.  For sequences, it will\nfind all segments that have Text TimelineFX and perform the find & replace.\n\nMenus:\n\nRight-click selected segments in a sequence -> Edit... -> Find and Replace in Text TimelineFX\n\nRight-click selected sequence or sequences -> Edit... -> Find and Replace in Text TimelineFX\n\nTo Install:\n\nFor all users, copy this file to:\n/opt/Autodesk/shared/python/\n\nFor a specific user on Linux, copy this file to:\n/home/<user_name>/flame/python/\n\nFor a specific user on Mac, copy this file to:\n/Users/<user_name>/Library/Preferences/Autodesk/flame/python/"
  },
  {
    "Script Name": "find replace in type",
    "Script Version": "1.0.0",
    "Flame Version": "2026",
    "Maximum Flame Version": "Latest",
    "Author": "Kieran Hanrahan",
    "Creation Date": "03.02.25",
    "Update Date": "04.21.25",
    "Description": "Script Name: Find and Replace in Type\nWritten by: Kieran Hanrahan\n\nScript Version: 1.0.0\nFlame Version: 2026\n\nURL: http://github.com/khanrahan/find-replace-in-type\n\nCreation Date: 03.02.25\nUpdate Date: 04.21.25\n\nDescription:\n\nThis script will find a specified search string within a Type TimelineFX and\nreplace that search term with something else without having to enter the Type\neditor.\n\nWorks on segments or sequences containing Type TimelineFX.  For sequences, it will\nfind all segments that have Type TimelineFX and perform the find & replace.\n\nMenus:\n\nRight-click selected segments in a sequence -> Edit... -> Find and Replace in Type TimelineFX\n\nRight-click selected sequence or sequences -> Edit... -> Find and Replace in Type TimelineFX\n\nTo Install:\n\nFor all users, copy this file to:\n/opt/Autodesk/shared/python\n\nFor a specific user, copy this file to:\n/opt/Autodesk/user/<user name>/python"
  },
  {
    "Script Name": "fix corrupt action",
    "Script Version": "1.1",
    "Flame Version": "2025",
    "Maximum Flame Version": "Latest",
    "Author": "John Geehreng (adjusted by Finn Jaeger to only fix corrupted actions)",
    "Creation Date": "12.11.24",
    "Update Date": "12.11.24",
    "Description": "Script Name: Fix Corrupt Actions\nScript Version: 1.1\nFlame Version: 2025\nWritten by: John Geehreng (adjusted by Finn Jaeger to only fix corrupted actions)\nCreation Date: 12.11.24\n\nScript Type: MediaPanel\n\nDescription:\n\nFixes corrupt TLactions by exporting and then reloading the setups\n\nMenu:\n\nRight-click on selected sequences in the Media Panel -> UC Timelines -> Fix Corrupt Actions\n\nTo install:\n\nCopy script folder into /opt/Autodesk/shared/python"
  },
  {
    "Script Name": "fix in between frames",
    "Script Version": "1.0.1",
    "Flame Version": "2026.1",
    "Maximum Flame Version": "Latest",
    "Author": "John Geehreng",
    "Creation Date": "08.07.25",
    "Update Date": "08.11.25",
    "Description": "Script Name: Fix In Between Frames\nScript Version: 1.0.1\nFlame Version: 2026.1\nWritten by: John Geehreng\nCreation Date: 08.07.25\nUpdate Date: 08.11.25\n\nScript Type: Batch\n\nDescription:\n\nAdds a 2D stabilizer, then applies a timewarp to 'edit' out the problematic frames, followed by another timewarp to fix in between frames selected by the UI.\n\nMenu:\n\nBatch -> Timewarp Tools -> Fix In Between Frames\n\nTo install:\n\nCopy script folder into /opt/Autodesk/shared/python\n\nUpdates:\nv1.0.1 08.11.25\n- Changed Connection to 'Default' so it won't break when applying to a clip vs a node.\n\nv1.0.0 08.06.25\n- Initial Release"
  },
  {
    "Script Name": "fix premiere xmls",
    "Script Version": "2.1.2",
    "Flame Version": "2023.2",
    "Maximum Flame Version": "Latest",
    "Author": "Ted Stanley, John Geehreng, and Michael Vaglienty",
    "Creation Date": "03.03.21",
    "Update Date": "02.13.25",
    "Description": "Script Name: fix premiere xmls\nScript Version: 2.1.2\nFlame Version: 2023.2\nWritten by: Ted Stanley, John Geehreng, and Michael Vaglienty\nCreation Date: 03.03.21\nUpdate Date: 02.13.25\n\nScript Type: MediaHub\n\nDescription:\n\nFix and/or Resize Adobe Premiere XML's.\n\nMenus:\n\nMediaHub -> XML Prep -> Fix Premiere XML's\n\nTo install:\n\nCopy script into /opt/Autodesk/shared/python/fix_premiere_xmls\n\nUpdates:\n02.13.25 - v2.1.2  Update to latest pyflame lib and SCRIPT_PATH = os.path.abspath(os.path.dirname(__file__))\n05.06.24 - v2.1.1  Changed Scoping to show up only if xml's are selected\n04.03.24 - v2.1    Fixed renaming issue\n12.05.23 - v2.0.2  Fixed the missing fixduration() problem. Made _x_res names consistent.\n11.28.23 - v2.0.1  Updated for pyflame lib v2. Added ability to resize xmls. Changed the output names based on options\n11.12.23 - v1.94   Fixed the Scale Factor Calculator to use the correct width or height. Added try/except when using the \"Clean Names\" option.\n09.08.22 - v1.93   2023.2 Ordering and Scale Factor Calculator\n05.24.22 - v1.92   Update from Ted - This one fixes almost everything. Except dissolves, those still suck.\n04.19.22 - v1.91   2023 UI\n02.19.22 - v1.90   Created option for automatically using the xml's resolution\n12.27.21 - Turned off \"v\" to \"V\" when sanatizing names\n11.15.21 - Added the ability to scale values over 100\n09.03.21 - Made sanatizing the names optional\n08.27.21 - Turned off the \"That Totally Worked\" message as you can see the update in the MediaHub\n08.13.21 - Change XML Bit Depth to Project Settings\n06.04.21 - Change Default Scale Value to 100 for graphics. Renamed \"Cancel\" button to say \"Close\"\n05.17.21 - Added the ability to select multiple .xml's and added Ted's nested layer fix\n03.19.21 - Python3 Updates"
  }
]